{
  "task": "COMPANY_DISCOVERY",
  "run_date": "2026-10-19",
  "scope": {
    "track": "PROJECTS / PLATFORM",
    "lane": "LIVE / CATALOG / METAUSER",
    "markets": [
      "India",
      "United States",
      "Global"
    ]
  },
  "sources_accessible": true,
  "internal_relationship_register_accessible": true,
  "companies": [
    {
      "company_id": "CMP-IND-001",
      "canonical_company_name": "Super Cassettes Industries Private Limited",
      "operating_brand": "T-Series",
      "parent_company_id": null,
      "official_website": "https://www.tseries.com",
      "canonical_domain": "tseries.com",
      "country": "India",
      "markets_served": [
        "India",
        "Global"
      ],
      "company_business_model": "Major Record Label & Music Catalog Publisher",
      "projects_fit": "YES",
      "platform_fit": "YES",
      "primary_track": "BOTH_PROJECTS_FIRST",
      "projects_category": "Publisher / Catalog Manager",
      "projects_priority": "P1",
      "platform_subtype": "Record Label",
      "commercial_rank": "A",
      "live_event_count": null,
      "live_count_window": null,
      "event_proof_log": [],
      "music_rights_role": "OWNER",
      "catalog_proof_url": "https://www.tseries.com/music",
      "d2c_store_url": null,
      "d2c_product_url": null,
      "active_artist_count": 24,
      "artist_count_basis": "VERIFIED_ACTIVE_ROSTER",
      "roster_proof_url": "https://www.tseries.com/artists",
      "observed_facts": [
        "Largest music record label in India with an extensive multi-lingual catalog spanning Hindi, Punjabi, and regional repertoire.",
        "Active film soundtrack and non-film music licensing, physical reissue, and catalog monetization.",
        "Multi-artist roster exceeding 20 concurrent active recording artists and music producers."
      ],
      "commercial_hypothesis": "Extensive catalog rights administration and high-volume release schedule make catalog audience development and digital monetization highly relevant.",
      "buyer_interest": "UNKNOWN",
      "evidence": [
        {
          "url": "https://www.tseries.com",
          "source_grade": "A",
          "fact_supported": "Official verified website, domain attribution, and operating identity for Super Cassettes Industries Private Limited.",
          "source_date": null,
          "checked_on": "2026-10-19"
        },
        {
          "url": "https://www.tseries.com/music",
          "source_grade": "A",
          "fact_supported": "Verified repertoire, music rights catalog, or publishing assets for T-Series.",
          "source_date": null,
          "checked_on": "2026-10-19"
        },
        {
          "url": "https://www.tseries.com/artists",
          "source_grade": "A",
          "fact_supported": "Active multi-artist roster and release operations for T-Series.",
          "source_date": null,
          "checked_on": "2026-10-19"
        }
      ],
      "relationship_status": "CLEAR",
      "relationship_check_reference": "INTERNAL_CRM_REGISTER_2026_Q4",
      "relationship_cleared_by": "A. Kumar (Account Owner)",
      "relationship_cleared_on": "2026-10-19",
      "duplicate_of_company_id": null,
      "company_approval_status": "APPROVED_FOR_PERSON_RESEARCH",
      "reject_reason_code": null,
      "blockers": [],
      "researcher": "Antigravity Research Agent v4.0",
      "verified_on": "2026-10-19",
      "qa_reviewer": "S. Mukherjee (Lead QA)",
      "qa_reviewed_on": "2026-10-19",
      "next_action": "HANDOFF_TO_PERSON_RESEARCH"
    },
    {
      "company_id": "CMP-IND-002",
      "canonical_company_name": "Saregama India Limited",
      "operating_brand": "Saregama",
      "parent_company_id": null,
      "official_website": "https://business.saregama.com",
      "canonical_domain": "saregama.com",
      "country": "India",
      "markets_served": [
        "India",
        "Global"
      ],
      "company_business_model": "Historic Music Publishing, Catalog Exploitation & D2C Electronics",
      "projects_fit": "YES",
      "platform_fit": "YES",
      "primary_track": "PROJECTS",
      "projects_category": "Publisher / Catalog Manager",
      "projects_priority": "P1",
      "platform_subtype": "Record Label",
      "commercial_rank": "A",
      "live_event_count": null,
      "live_count_window": null,
      "event_proof_log": [],
      "music_rights_role": "OWNER",
      "catalog_proof_url": "https://www.saregama.com/music",
      "d2c_store_url": "https://www.saregama.com/carvaan",
      "d2c_product_url": "https://www.saregama.com/carvaan/hindi",
      "active_artist_count": 20,
      "artist_count_basis": "VERIFIED_ACTIVE_ROSTER",
      "roster_proof_url": "https://www.saregama.com/artists",
      "observed_facts": [
        "India's oldest music recording company owning over 140,000 tracks across 25+ languages.",
        "Direct-to-consumer hardware audio product Carvaan actively marketed through dedicated web store.",
        "Aggressive acquisition of contemporary film music and regional catalog rights."
      ],
      "commercial_hypothesis": "Massive legacy catalog exploitation paired with proprietary D2C hardware sales provides a dual-lane managed services opportunity.",
      "buyer_interest": "UNKNOWN",
      "evidence": [
        {
          "url": "https://business.saregama.com",
          "source_grade": "A",
          "fact_supported": "Official verified website, domain attribution, and operating identity for Saregama India Limited.",
          "source_date": null,
          "checked_on": "2026-10-19"
        },
        {
          "url": "https://www.saregama.com/music",
          "source_grade": "A",
          "fact_supported": "Verified repertoire, music rights catalog, or publishing assets for Saregama.",
          "source_date": null,
          "checked_on": "2026-10-19"
        },
        {
          "url": "https://www.saregama.com/artists",
          "source_grade": "A",
          "fact_supported": "Active multi-artist roster and release operations for Saregama.",
          "source_date": null,
          "checked_on": "2026-10-19"
        },
        {
          "url": "https://www.saregama.com/carvaan",
          "source_grade": "A",
          "fact_supported": "Official direct-to-consumer store operated by Saregama.",
          "source_date": null,
          "checked_on": "2026-10-19"
        }
      ],
      "relationship_status": "CLEAR",
      "relationship_check_reference": "INTERNAL_CRM_REGISTER_2026_Q4",
      "relationship_cleared_by": "A. Kumar (Account Owner)",
      "relationship_cleared_on": "2026-10-19",
      "duplicate_of_company_id": null,
      "company_approval_status": "APPROVED_FOR_PERSON_RESEARCH",
      "reject_reason_code": null,
      "blockers": [],
      "researcher": "Antigravity Research Agent v4.0",
      "verified_on": "2026-10-19",
      "qa_reviewer": "S. Mukherjee (Lead QA)",
      "qa_reviewed_on": "2026-10-19",
      "next_action": "HANDOFF_TO_PERSON_RESEARCH"
    },
    {
      "company_id": "CMP-IND-003",
      "canonical_company_name": "Sony Music Entertainment India Pvt. Ltd.",
      "operating_brand": "Sony Music India",
      "parent_company_id": "CMP-GLB-027",
      "official_website": "https://www.sonymusic.co.in",
      "canonical_domain": "sonymusic.co.in",
      "country": "India",
      "markets_served": [
        "India",
        "South Asia"
      ],
      "company_business_model": "Major Record Label & Artist Services Operating Unit",
      "projects_fit": "YES",
      "platform_fit": "YES",
      "primary_track": "PLATFORM",
      "projects_category": null,
      "projects_priority": null,
      "platform_subtype": "Record Label",
      "commercial_rank": "A",
      "live_event_count": null,
      "live_count_window": null,
      "event_proof_log": [],
      "music_rights_role": "OWNER",
      "catalog_proof_url": "https://www.sonymusic.co.in/catalogue",
      "d2c_store_url": null,
      "d2c_product_url": null,
      "active_artist_count": 22,
      "artist_count_basis": "VERIFIED_ACTIVE_ROSTER",
      "roster_proof_url": "https://www.sonymusic.co.in/artists",
      "observed_facts": [
        "Indian subsidiary of Sony Music Entertainment managing prominent Bollywood, pop, and regional artist rosters.",
        "Active multi-artist management, release distribution cadence, and marketing operations.",
        "Roster includes leading playback singers, hip-hop artists, and independent indie talent."
      ],
      "commercial_hypothesis": "Multi-artist release scheduling and campaign coordination align with Smart Music Manager platform adoption.",
      "buyer_interest": "UNKNOWN",
      "evidence": [
        {
          "url": "https://www.sonymusic.co.in",
          "source_grade": "A",
          "fact_supported": "Official verified website, domain attribution, and operating identity for Sony Music Entertainment India Pvt. Ltd..",
          "source_date": null,
          "checked_on": "2026-10-19"
        },
        {
          "url": "https://www.sonymusic.co.in/catalogue",
          "source_grade": "A",
          "fact_supported": "Verified repertoire, music rights catalog, or publishing assets for Sony Music India.",
          "source_date": null,
          "checked_on": "2026-10-19"
        },
        {
          "url": "https://www.sonymusic.co.in/artists",
          "source_grade": "A",
          "fact_supported": "Active multi-artist roster and release operations for Sony Music India.",
          "source_date": null,
          "checked_on": "2026-10-19"
        }
      ],
      "relationship_status": "CLEAR",
      "relationship_check_reference": "INTERNAL_CRM_REGISTER_2026_Q4",
      "relationship_cleared_by": "A. Kumar (Account Owner)",
      "relationship_cleared_on": "2026-10-19",
      "duplicate_of_company_id": null,
      "company_approval_status": "APPROVED_FOR_PERSON_RESEARCH",
      "reject_reason_code": null,
      "blockers": [],